{
  "schema_version": "1.1",
  "approval_request_id": "appr_network_change_001",
  "decision": "approve",
  "decided_by": "user:jsmith",
  "decider_role": "security_review",
  "reason": "Scope limited to preprod and egress is being tightened.",
  "conditions": [
    "Run network regression tests before merge"
  ],
  "decided_at": "2026-02-21T10:30:00-06:00",
  "trace_id": "trc_appr_002"
}
